{"schema_version":"1.0.0","protocol_version":"1.2","candidate_id":"candidate-1","revision_hash":"aaaaaaaaaaaaaaaaaaaaaaaaaaaaaaaaaaaaaaaaaaaaaaaaaaaaaaaaaaaaaaaa","correlation_id":"review-1","idempotency_key":"proposal-1","agent_hash":"0123456789abcdef","surface":"skills","target":"example-skill","state":"proposed","evidence_hashes":["0123456789abcdef"],"requires_human":false,"created_at":"2026-09-15T00:00:00Z","updated_at":"2026-09-15T00:00:00Z"}
